{
  "$schema": "https://json-schema.org/draft/2020-12/schema",
  "$id": "https://pbs-bureau.dev/fresh-plan/schemas/extension-manifest.schema.json",
  "title": "Extension manifest",
  "description": "Formal schema for the framework-core extension manifest contract per D29 (extension manifest contract + validation flow). The `extends` slot was removed per D31. Notation: JSON Schema Draft 2020-12 per D28. Layer-3 formal schema per D11. Cross-kind referential integrity (e.g., spec-ref resolution, identifier collision across extensions, conformance of referenced specs) is out of scope per D28; handled by the framework conformance validator (D30 + D32). Per D34 §2.4: the `vocabulary-slot` enum is intentionally closed at the six core open-vocabulary slots; adding a new open-vocabulary slot is a major bump on this contract per D33.",

  "type": "object",
  "required": [
    "id",
    "version",
    "vocabulary-registrations",
    "provisions",
    "dependencies"
  ],
  "additionalProperties": false,
  "properties": {
    "id": {
      "$ref": "_common.schema.json#/$defs/vocabulary-identifier",
      "description": "Stable extension identifier (D29 §1). Identifiers registered by an extension are implicitly namespaced by this id; canonical fully-qualified form is '<extension-id>:<vocabulary-identifier>' per D29."
    },
    "version": {
      "$ref": "_common.schema.json#/$defs/semver",
      "description": "Version designator (D29 §1; D33 versioning policy)."
    },
    "vocabulary-registrations": {
      "type": "array",
      "description": "List of (slot, identifier, spec-ref) tuples that add values to a core open-vocabulary slot (D29 §2). Required slot; may be [] (per D13 required-with-explicit-empty pattern).",
      "items": { "$ref": "#/$defs/vocabulary-registration" }
    },
    "provisions": {
      "type": "array",
      "description": "List of (kind, id, spec-ref) tuples — actual instances of kinds that this extension provides (D29 §3). Kinds that admit provisions: substrate, shape, adapter, specialist. (workspace, event, actor, work-unit are not extension-provided per D29.) Required slot; may be [].",
      "items": { "$ref": "#/$defs/provision" }
    },
    "dependencies": {
      "type": "object",
      "description": "Dependencies the extension's provisions need to compose against (D29 §4). Both sub-slots are required; both may be [].",
      "required": ["required-core-capabilities", "required-extensions"],
      "additionalProperties": false,
      "properties": {
        "required-core-capabilities": {
          "type": "array",
          "description": "Abstract core capabilities the provisions need (D17: hooks, skills, event-chain).",
          "items": {
            "type": "string",
            "enum": ["hooks", "skills", "event-chain"]
          },
          "uniqueItems": true
        },
        "required-extensions": {
          "type": "array",
          "description": "Other extensions this one depends on, by (id, version-range). Cycle detection + load order per D32; version-conflict resolution per D33.",
          "items": { "$ref": "#/$defs/extension-reference" }
        }
      }
    }
  },

  "$defs": {
    "spec-ref": {
      "type": "string",
      "description": "Reference to a value's specification (typically a JSON Schema per D28). Treated as opaque-string-resolvable-by-the-loader per D29 — within-package paths, URLs, and registry references all admissible.",
      "minLength": 1,
      "examples": [
        "./specs/a2a-peer-protocol.schema.json",
        "https://example.org/specs/some.schema.json",
        "registry://some-namespace/some-spec@1.0.0"
      ]
    },

    "extension-reference": {
      "type": "object",
      "description": "Reference to another extension by id + version range (used by 'dependencies.required-extensions[]').",
      "required": ["id", "version-range"],
      "additionalProperties": false,
      "properties": {
        "id": { "$ref": "_common.schema.json#/$defs/vocabulary-identifier" },
        "version-range": { "$ref": "_common.schema.json#/$defs/version-range" }
      }
    },

    "vocabulary-slot": {
      "type": "string",
      "description": "The set of framework-core open-vocabulary slots into which an extension may register a value, per D29 §2. Closed enum (per D34 §2.4); adding a new slot is a major bump per D33.",
      "enum": [
        "event.payload-subtype",
        "work-unit.kind",
        "substrate.capabilities",
        "substrate.runtime-shapes",
        "adapter.protocol-or-transport",
        "actor.subtype"
      ]
    },

    "vocabulary-registration": {
      "type": "object",
      "description": "A single (slot, identifier, spec-ref) tuple registering one value into one core open-vocabulary slot. The identifier is namespaced to the declaring extension per D29.",
      "required": ["slot", "identifier", "spec-ref"],
      "additionalProperties": false,
      "properties": {
        "slot": { "$ref": "#/$defs/vocabulary-slot" },
        "identifier": { "$ref": "_common.schema.json#/$defs/vocabulary-identifier" },
        "spec-ref": { "$ref": "#/$defs/spec-ref" }
      }
    },

    "provision-kind": {
      "type": "string",
      "description": "The set of kinds that admit extension-provided provisions, per D29 §3. Excludes workspace (per-deployment manifest) and event / actor / work-unit (runtime instances).",
      "enum": ["substrate", "shape", "adapter", "specialist"]
    },

    "provision": {
      "type": "object",
      "description": "A single (kind, id, spec-ref) tuple — one provision the extension provides. The provision conforms to its kind's layer-3 formal schema.",
      "required": ["kind", "id", "spec-ref"],
      "additionalProperties": false,
      "properties": {
        "kind": { "$ref": "#/$defs/provision-kind" },
        "id": { "$ref": "_common.schema.json#/$defs/vocabulary-identifier" },
        "spec-ref": { "$ref": "#/$defs/spec-ref" }
      }
    }
  }
}
