{
  "id": "inprocess-substrate-ext",
  "version": "0.1.0",
  "vocabulary-registrations": [],
  "provisions": [
    {
      "kind": "substrate",
      "id": "inprocess-substrate",
      "spec-ref": "./substrate.json"
    }
  ],
  "dependencies": {
    "required-core-capabilities": [],
    "required-extensions": []
  }
}
