{
  "id": "direct-api-ext",
  "version": "0.1.0",
  "vocabulary-registrations": [
    {
      "slot": "adapter.protocol-or-transport",
      "identifier": "direct-api",
      "spec-ref": "./direct-api.schema.json"
    }
  ],
  "provisions": [
    {
      "kind": "adapter",
      "id": "direct-api-adapter",
      "spec-ref": "./adapter.json"
    }
  ],
  "dependencies": {
    "required-core-capabilities": [],
    "required-extensions": []
  }
}
