{
  "id": "generic-shape-ext",
  "version": "0.1.0",
  "vocabulary-registrations": [],
  "provisions": [
    {
      "kind": "shape",
      "id": "generic-shape",
      "spec-ref": "./shape.json"
    }
  ],
  "dependencies": {
    "required-core-capabilities": [],
    "required-extensions": []
  }
}
