{
  "id": "generic-specialist-ext",
  "version": "0.1.0",
  "vocabulary-registrations": [
    {
      "slot": "work-unit.kind",
      "identifier": "generic-task",
      "spec-ref": "./generic-task.schema.json"
    }
  ],
  "provisions": [
    {
      "kind": "specialist",
      "id": "generic-specialist",
      "spec-ref": "./specialist.json"
    }
  ],
  "dependencies": {
    "required-core-capabilities": [],
    "required-extensions": []
  }
}
