{
  "id": "mcp-server-side-ext",
  "version": "0.1.0",
  "vocabulary-registrations": [
    {
      "slot": "adapter.protocol-or-transport",
      "identifier": "mcp-server",
      "spec-ref": "./mcp-server.schema.json"
    }
  ],
  "provisions": [
    {
      "kind": "adapter",
      "id": "mcp-server-side-adapter",
      "spec-ref": "./adapter.json"
    }
  ],
  "dependencies": {
    "required-core-capabilities": [],
    "required-extensions": []
  }
}
