{
  "id": "rag-via-mcp-ext",
  "version": "0.2.0",
  "vocabulary-registrations": [
    {
      "slot": "work-unit.kind",
      "identifier": "retrieval-task",
      "spec-ref": "./retrieval-task.schema.json"
    }
  ],
  "provisions": [
    {
      "kind": "specialist",
      "id": "rag-realwire-specialist",
      "spec-ref": "./specialist.json"
    }
  ],
  "dependencies": {
    "required-core-capabilities": [],
    "required-extensions": [
      { "id": "mcp-server-ext", "version-range": ">=0.2.0" }
    ]
  }
}
